{
  "$schema": "http://json-schema.org/draft-07/schema#",
  "title": "n8n Workflow Schema",
  "type": "object",
  "required": ["name", "nodes", "connections"],
  "properties": {
    "name": {
      "type": "string",
      "description": "The name of the workflow"
    },
    "active": {
      "type": "boolean",
      "default": false
    },
    "nodes": {
      "type": "array",
      "minItems": 1,
      "items": {
        "type": "object",
        "required": ["id", "name", "type", "typeVersion", "position"],
        "properties": {
          "id": {
            "type": "string",
            "pattern": "^[a-f0-9-]{36}$"
          },
          "name": {
            "type": "string"
          },
          "type": {
            "type": "string"
          },
          "typeVersion": {
            "type": "number"
          },
          "position": {
            "type": "array",
            "items": {
              "type": "number"
            },
            "minItems": 2,
            "maxItems": 2
          },
          "parameters": {
            "type": "object"
          },
          "credentials": {
            "type": "object"
          }
        }
      }
    },
    "connections": {
      "type": "object",
      "description": "Node connections mapping"
    },
    "pinData": {
      "type": "object"
    },
    "settings": {
      "type": "object",
      "properties": {
        "executionOrder": {
          "type": "string",
          "enum": ["v0", "v1"]
        }
      }
    },
    "staticData": {
      "type": "object"
    },
    "tags": {
      "type": "array",
      "items": {
        "type": "object",
        "properties": {
          "createdAt": {
            "type": "string"
          },
          "updatedAt": {
            "type": "string"
          },
          "id": {
            "type": "string"
          },
          "name": {
            "type": "string"
          }
        }
      }
    },
    "triggerCount": {
      "type": "number"
    },
    "updatedAt": {
      "type": "string"
    },
    "versionId": {
      "type": "string"
    }
  },
  "additionalProperties": true
}